{"schema_version": "1.0.0", "synthetic": false, "tenant_id": "11111111-1111-4111-8111-111111111111", "cloud": "public", "captured_at": "2026-09-30T12:00:00Z", "exporter": {"id": "intune-iac-settings-catalog-graph", "version": "1.0.0"}, "collections": [{"kind": "policies", "owner_id": null, "coverage": "complete", "reason": null, "pages": [{"request_url": "https://graph.microsoft.com/beta/deviceManagement/configurationPolicies", "method": "GET", "http_status": 200, "captured_at": "2026-09-30T12:00:00Z", "body": {"value": [{"@odata.type": "#microsoft.graph.deviceManagementConfigurationPolicy", "id": "22222222-2222-4222-8222-222222222222", "name": "Windows Privacy Pilot", "description": "Synthetic reference; not production advice.", "platforms": "windows10", "technologies": "mdm", "roleScopeTagIds": ["0"], "createdDateTime": "2026-09-30T12:00:00Z", "lastModifiedDateTime": "2026-09-30T12:00:00Z", "settingCount": 1, "isAssigned": false, "templateReference": {"templateId": "", "templateFamily": "none", "templateDisplayName": null, "templateDisplayVersion": null}}, {"@odata.type": "#microsoft.graph.deviceManagementConfigurationPolicy", "id": "33333333-3333-4333-8333-333333333333", "name": "Windows Privacy Pilot", "description": "Synthetic reference; not production advice.", "platforms": "windows10", "technologies": "mdm", "roleScopeTagIds": ["0"], "createdDateTime": "2026-09-30T12:00:00Z", "lastModifiedDateTime": "2026-09-30T12:00:00Z", "settingCount": 1, "isAssigned": true, "templateReference": {"templateId": "", "templateFamily": "none", "templateDisplayName": null, "templateDisplayVersion": null}}]}}]}, {"kind": "settings", "owner_id": "22222222-2222-4222-8222-222222222222", "coverage": "complete", "reason": null, "pages": [{"request_url": "https://graph.microsoft.com/beta/deviceManagement/configurationPolicies/22222222-2222-4222-8222-222222222222/settings", "method": "GET", "http_status": 200, "captured_at": "2026-09-30T12:00:00Z", "body": {"value": [{"@odata.type": "#microsoft.graph.deviceManagementConfigurationSetting", "id": "0", "settingInstance": {"@odata.type": "#microsoft.graph.deviceManagementConfigurationChoiceSettingInstance", "settingDefinitionId": "device_vendor_msft_policy_config_privacy_letappsaccesslocation", "settingInstanceTemplateReference": null, "choiceSettingValue": {"@odata.type": "#microsoft.graph.deviceManagementConfigurationChoiceSettingValue", "settingValueTemplateReference": null, "value": "device_vendor_msft_policy_config_privacy_letappsaccesslocation_2", "children": []}}}]}}]}, {"kind": "assignments", "owner_id": "22222222-2222-4222-8222-222222222222", "coverage": "complete", "reason": null, "pages": [{"request_url": "https://graph.microsoft.com/beta/deviceManagement/configurationPolicies/22222222-2222-4222-8222-222222222222/assignments", "method": "GET", "http_status": 200, "captured_at": "2026-09-30T12:00:00Z", "body": {"value": [], "@odata.count": 2}}]}], "references": [], "ownership": []}