{
  "schema_version": "1.0.0",
  "synthetic": true,
  "tenant_id": "11111111-1111-4111-8111-111111111111",
  "cloud": "public",
  "captured_at": "2026-09-30T12:00:00Z",
  "exporter": {
    "id": "appendix-b-graph-snapshot",
    "version": "1.0.0"
  },
  "collections": [
    {
      "kind": "policies",
      "owner_id": null,
      "coverage": "complete",
      "reason": null,
      "pages": [
        {
          "request_url": "https://graph.microsoft.com/beta/deviceManagement/configurationPolicies",
          "method": "GET",
          "http_status": 200,
          "captured_at": "2026-09-30T12:00:00Z",
          "body": {
            "value": [
              {
                "@odata.type": "#microsoft.graph.deviceManagementConfigurationPolicy",
                "id": "22222222-2222-4222-8222-222222222222",
                "name": "Windows Privacy Pilot",
                "description": "Synthetic reference; not production advice.",
                "platforms": "windows10",
                "technologies": "mdm",
                "roleScopeTagIds": [
                  "0"
                ],
                "createdDateTime": "2026-09-30T12:00:00Z",
                "lastModifiedDateTime": "2026-09-30T12:00:00Z",
                "settingCount": 1,
                "isAssigned": true,
                "templateReference": {
                  "templateId": "",
                  "templateFamily": "none",
                  "templateDisplayName": null,
                  "templateDisplayVersion": null
                }
              },
              {
                "@odata.type": "#microsoft.graph.deviceManagementConfigurationPolicy",
                "id": "33333333-3333-4333-8333-333333333333",
                "name": "Windows Privacy Pilot",
                "description": "Synthetic reference; not production advice.",
                "platforms": "windows10",
                "technologies": "mdm",
                "roleScopeTagIds": [
                  "0"
                ],
                "createdDateTime": "2026-09-30T12:00:00Z",
                "lastModifiedDateTime": "2026-09-30T12:00:00Z",
                "settingCount": 1,
                "isAssigned": true,
                "templateReference": {
                  "templateId": "",
                  "templateFamily": "none",
                  "templateDisplayName": null,
                  "templateDisplayVersion": null
                }
              }
            ]
          }
        }
      ]
    },
    {
      "kind": "settings",
      "owner_id": "22222222-2222-4222-8222-222222222222",
      "coverage": "complete",
      "reason": null,
      "pages": [
        {
          "request_url": "https://graph.microsoft.com/beta/deviceManagement/configurationPolicies/22222222-2222-4222-8222-222222222222/settings",
          "method": "GET",
          "http_status": 200,
          "captured_at": "2026-09-30T12:00:00Z",
          "body": {
            "value": [
              {
                "@odata.type": "#microsoft.graph.deviceManagementConfigurationSetting",
                "id": "0",
                "settingInstance": {
                  "@odata.type": "#microsoft.graph.deviceManagementConfigurationChoiceSettingInstance",
                  "settingDefinitionId": "device_vendor_msft_policy_config_privacy_letappsaccesslocation",
                  "settingInstanceTemplateReference": null,
                  "choiceSettingValue": {
                    "@odata.type": "#microsoft.graph.deviceManagementConfigurationChoiceSettingValue",
                    "settingValueTemplateReference": null,
                    "value": "device_vendor_msft_policy_config_privacy_letappsaccesslocation_2",
                    "children": []
                  }
                }
              }
            ]
          }
        }
      ]
    },
    {
      "kind": "assignments",
      "owner_id": "22222222-2222-4222-8222-222222222222",
      "coverage": "partial",
      "reason": "Next page unavailable",
      "pages": [
        {
          "request_url": "https://graph.microsoft.com/beta/deviceManagement/configurationPolicies/22222222-2222-4222-8222-222222222222/assignments",
          "method": "GET",
          "http_status": 200,
          "captured_at": "2026-09-30T12:00:00Z",
          "body": {
            "value": [
              {
                "@odata.type": "#microsoft.graph.deviceManagementConfigurationPolicyAssignment",
                "id": "aaaaaaaa-aaaa-4aaa-8aaa-000000000001",
                "target": {
                  "@odata.type": "#microsoft.graph.groupAssignmentTarget",
                  "groupId": "44444444-4444-4444-8444-444444444444",
                  "deviceAndAppManagementAssignmentFilterType": "include",
                  "deviceAndAppManagementAssignmentFilterId": "77777777-7777-4777-8777-777777777777"
                }
              },
              {
                "@odata.type": "#microsoft.graph.deviceManagementConfigurationPolicyAssignment",
                "id": "aaaaaaaa-aaaa-4aaa-8aaa-000000000002",
                "target": {
                  "@odata.type": "#microsoft.graph.groupAssignmentTarget",
                  "groupId": "55555555-5555-4555-8555-555555555555",
                  "deviceAndAppManagementAssignmentFilterType": "none",
                  "deviceAndAppManagementAssignmentFilterId": null
                }
              },
              {
                "@odata.type": "#microsoft.graph.deviceManagementConfigurationPolicyAssignment",
                "id": "aaaaaaaa-aaaa-4aaa-8aaa-000000000003",
                "target": {
                  "@odata.type": "#microsoft.graph.exclusionGroupAssignmentTarget",
                  "groupId": "66666666-6666-4666-8666-666666666666",
                  "deviceAndAppManagementAssignmentFilterType": "none",
                  "deviceAndAppManagementAssignmentFilterId": null
                }
              }
            ],
            "@odata.nextLink": "https://graph.microsoft.com/beta/deviceManagement/configurationPolicies/22222222-2222-4222-8222-222222222222/assignments?$skiptoken=page2"
          }
        }
      ]
    }
  ],
  "references": [
    {
      "kind": "group",
      "id": "44444444-4444-4444-8444-444444444444",
      "ownership": "external",
      "coverage": "complete",
      "captured_at": "2026-09-30T12:00:00Z"
    },
    {
      "kind": "group",
      "id": "55555555-5555-4555-8555-555555555555",
      "ownership": "external",
      "coverage": "complete",
      "captured_at": "2026-09-30T12:00:00Z"
    },
    {
      "kind": "group",
      "id": "66666666-6666-4666-8666-666666666666",
      "ownership": "external",
      "coverage": "complete",
      "captured_at": "2026-09-30T12:00:00Z"
    },
    {
      "kind": "filter",
      "id": "77777777-7777-4777-8777-777777777777",
      "ownership": "external",
      "coverage": "complete",
      "captured_at": "2026-09-30T12:00:00Z"
    },
    {
      "kind": "scope_tag",
      "id": "0",
      "ownership": "external",
      "coverage": "complete",
      "captured_at": "2026-09-30T12:00:00Z"
    }
  ],
  "ownership": [
    {
      "object_id": "22222222-2222-4222-8222-222222222222",
      "current_writer": null,
      "adoption_intent": "propose_only"
    }
  ]
}
